{
  "schema_version": "1",
  "run_id": "20260825-135831-5ded14",
  "candidate_name": "yBANQ",
  "source_url": "https://www.ycombinator.com/companies/ybanq",
  "team": {
    "summary": "The founding team consists of Abhishek Ayyagari, Ganesh Mallya, and Ahamed Shah Wahidullah. The candidate data does not provide details on their backgrounds, technical expertise, or prior startup experience, so team execution strength cannot be fully assessed.",
    "citations": [
      "https://www.ycombinator.com/companies/ybanq"
    ]
  },
  "product": {
    "summary": "yBANQ is described as 'building a Bill.com for India to simplify collections and\u2026', suggesting a focus on automating payment collections for Indian businesses. However, the description does not specify if the product automates a single, named workflow end-to-end or if it acts as an agent making decisions and taking actions within that workflow. The agentic nature and workflow specificity are unclear from the available data.",
    "citations": [
      "https://www.ycombinator.com/companies/ybanq"
    ]
  },
  "market": {
    "summary": "The product targets the Indian market, aiming to simplify collections for businesses, which is a common need among SMBs. However, the data does not provide detail on market size, prevalence of the workflow, or a 'why now' factor such as regulatory or technological shifts.",
    "citations": [
      "https://www.ycombinator.com/companies/ybanq"
    ]
  },
  "traction": {
    "summary": "The only traction evidence available is that yBANQ participated in YC Winter 2020. No additional usage, funding, or community engagement data is provided.",
    "citations": [
      "https://www.ycombinator.com/companies/ybanq"
    ]
  },
  "risks": {
    "summary": "Key risks include lack of clarity on whether the product is agentic and fully automates a specific workflow, as well as insufficient information on the team's relevant experience and current traction.",
    "citations": [
      "https://www.ycombinator.com/companies/ybanq"
    ]
  },
  "differentiation": {
    "summary": "There is no evidence in the candidate data of a defensible edge such as proprietary data, deep workflow integration, or unique distribution. The product is positioned as a regional adaptation of Bill.com, but differentiation specifics are not provided.",
    "citations": [
      "https://www.ycombinator.com/companies/ybanq"
    ]
  },
  "score": {
    "product_fit": 9.0,
    "team_execution": 7.5,
    "market_timing": 8.0,
    "traction": 3.0,
    "differentiation": 2.0,
    "total": 29.5
  },
  "confidence": "high",
  "flags": []
}