{
  "schema_version": "1",
  "run_id": "20260825-142916-0d7264",
  "candidate_name": "LedgerUp",
  "source_url": "https://www.ycombinator.com/companies/ledgerup",
  "team": {
    "summary": "The only available team information is the founder's name, Bailey Spell. There is no detail on domain expertise, technical background, or prior startup experience, so team execution cannot be confidently assessed.",
    "citations": [
      "https://www.ycombinator.com/companies/ledgerup"
    ]
  },
  "product": {
    "summary": "LedgerUp claims to offer 'AI agents that handles complex billing and revenue.' This suggests automation of billing and revenue workflows, but the description is broad and does not specify a single, named workflow or clarify if the agent acts end-to-end for SMBs.",
    "citations": [
      "https://www.ycombinator.com/companies/ledgerup"
    ]
  },
  "market": {
    "summary": "The product appears to target billing and revenue management, which are common workflows for SMBs. However, the data does not explicitly state SMBs as the primary buyer or provide a 'why now' rationale.",
    "citations": [
      "https://www.ycombinator.com/companies/ledgerup"
    ]
  },
  "traction": {
    "summary": "The only traction evidence is participation in YC's Summer 2024 batch. There is no additional data on usage, funding, or community engagement.",
    "citations": [
      "https://www.ycombinator.com/companies/ledgerup"
    ]
  },
  "risks": {
    "summary": "Key risks include lack of clarity on the specific workflow automated, whether the product is agentic in the thesis sense, and insufficient information on team background and market focus.",
    "citations": [
      "https://www.ycombinator.com/companies/ledgerup"
    ]
  },
  "differentiation": {
    "summary": "There is no information provided about proprietary technology, data, workflow depth, or distribution strategy, so differentiation cannot be assessed.",
    "citations": [
      "https://www.ycombinator.com/companies/ledgerup"
    ]
  },
  "score": {
    "product_fit": 12.0,
    "team_execution": 5.0,
    "market_timing": 8.0,
    "traction": 4.5,
    "differentiation": 1.0,
    "total": 30.5
  },
  "confidence": "high",
  "flags": []
}