{
  "schema_version": "1",
  "run_id": "20260825-142916-0d7264",
  "candidate_name": "Recite",
  "source_url": "https://news.ycombinator.com/item?id=47248983",
  "team": {
    "summary": "The only founder listed is 'rivradev'. No additional information about the founder's background, domain expertise, or technical experience is provided, so it is not possible to assess team strength or execution capability beyond the presence of a technical founder (implied by the GitHub project).",
    "citations": [
      "https://github.com/rivradev/recite-agent-skill"
    ]
  },
  "product": {
    "summary": "Recite claims to provide a 'Skill and MCP so my AI agent does my bookkeeping,' suggesting automation of bookkeeping tasks via an AI agent. This implies a workflow-specific automation (bookkeeping), and the mention of an agent indicates agentic action. However, the exact scope and depth of workflow automation is unclear from the available data.",
    "citations": [
      "https://github.com/rivradev/recite-agent-skill"
    ]
  },
  "market": {
    "summary": "Bookkeeping is a common workflow across many SMBs, making the target market potentially broad. However, there is no explicit evidence in the data that SMBs are the primary buyer, nor is there a stated 'why now' for this solution.",
    "citations": [
      "https://github.com/rivradev/recite-agent-skill"
    ]
  },
  "traction": {
    "summary": "The only traction evidence is a Show HN post with 3 points. There is no information about users, customers, funding, or other adoption metrics.",
    "citations": [
      "https://news.ycombinator.com/item?id=47248983"
    ]
  },
  "risks": {
    "summary": "Key risks include unclear depth of workflow automation, lack of evidence for SMB focus, and minimal traction. The founder's background and ability to execute are also unknown.",
    "citations": [
      "https://github.com/rivradev/recite-agent-skill",
      "https://news.ycombinator.com/item?id=47248983"
    ]
  },
  "differentiation": {
    "summary": "There is no evidence of proprietary data, unique integrations, or defensible workflow depth. The product appears to be an open GitHub project, which may limit defensibility.",
    "citations": [
      "https://github.com/rivradev/recite-agent-skill"
    ]
  },
  "score": {
    "product_fit": 18.0,
    "team_execution": 7.5,
    "market_timing": 10.0,
    "traction": 3.0,
    "differentiation": 2.0,
    "total": 40.5
  },
  "confidence": "high",
  "flags": []
}