{
  "schema_version": "1",
  "run_id": "20260825-142916-0d7264",
  "candidate_name": "Magpie, a CLI to Turn Your AI Agent into a Bookkeeper",
  "source_url": "https://news.ycombinator.com/item?id=49091292",
  "team": {
    "summary": "The only founder listed is 'kvisner'. There is no information provided about the founder's background, domain expertise, or prior startup/technical experience, so team strength and execution capability cannot be confidently assessed.",
    "citations": [
      "https://news.ycombinator.com/item?id=49091292"
    ]
  },
  "product": {
    "summary": "Magpie is a CLI tool that enables any popular AI agent to perform double-entry bookkeeping, enforcing standard accounting rules and generating reports. It is designed to automate bookkeeping for small businesses, suggesting end-to-end workflow automation for this specific back-office task. The product acts as an agent by allowing AI to take actions within the bookkeeping workflow.",
    "citations": [
      "https://news.ycombinator.com/item?id=49091292"
    ]
  },
  "market": {
    "summary": "The product targets small businesses with simple bookkeeping needs, a common workflow among SMBs. The rationale is based on the founder's own experience running a small tech business. However, there is no explicit evidence of broader market demand or timing factors beyond the founder's anecdote.",
    "citations": [
      "https://news.ycombinator.com/item?id=49091292"
    ]
  },
  "traction": {
    "summary": "The only traction evidence is the Hacker News post, which has received 8 points. There is no mention of users, customers, funding, or other adoption metrics.",
    "citations": [
      "https://news.ycombinator.com/item?id=49091292"
    ]
  },
  "risks": {
    "summary": "Key risks include lack of evidence for team execution capability, unclear market adoption beyond the founder's own use case, and limited traction. It is also unclear how robust or secure the solution is for broader SMB use.",
    "citations": [
      "https://news.ycombinator.com/item?id=49091292"
    ]
  },
  "differentiation": {
    "summary": "Magpie differentiates itself by enabling any AI agent to perform double-entry bookkeeping via a CLI, enforcing standard accounting rules and integrating with Jaybase. However, there is no evidence of proprietary data, unique integrations, or defensible workflow depth beyond this technical approach.",
    "citations": [
      "https://news.ycombinator.com/item?id=49091292"
    ]
  },
  "score": {
    "product_fit": 27.0,
    "team_execution": 5.0,
    "market_timing": 10.0,
    "traction": 4.5,
    "differentiation": 4.0,
    "total": 50.5
  },
  "confidence": "high",
  "flags": []
}