{
  "schema_version": "1",
  "run_id": "20260825-135831-5ded14",
  "candidate_name": "haddock",
  "source_url": "https://www.ycombinator.com/companies/haddock",
  "team": {
    "summary": "The founders are Arnau Navarro and Pol Rosell. No further information about their backgrounds, technical expertise, or prior experience is provided in the available data.",
    "citations": [
      "https://www.ycombinator.com/companies/haddock"
    ]
  },
  "product": {
    "summary": "Haddock offers 'AI agents to run restaurant operations.' While this suggests automation and agentic behavior for restaurant workflows, the data does not specify which restaurant operations are automated or whether a single, named workflow is fully owned end-to-end.",
    "citations": [
      "https://www.ycombinator.com/companies/haddock"
    ]
  },
  "market": {
    "summary": "The product targets restaurant operations, which are common among SMBs in the food service sector. However, the data does not specify the breadth of workflow coverage or provide a 'why now' rationale.",
    "citations": [
      "https://www.ycombinator.com/companies/haddock"
    ]
  },
  "traction": {
    "summary": "The only traction evidence available is participation in YC Winter 2022. No additional usage, funding, or community engagement data is provided.",
    "citations": [
      "https://www.ycombinator.com/companies/haddock"
    ]
  },
  "risks": {
    "summary": "Key risks include lack of detail on the specific workflow(s) automated, uncertainty about agentic depth, and no information on founder domain expertise or current traction beyond YC participation.",
    "citations": [
      "https://www.ycombinator.com/companies/haddock"
    ]
  },
  "differentiation": {
    "summary": "There is no information provided about proprietary technology, unique integrations, or defensible advantages. Differentiation cannot be assessed from the available data.",
    "citations": [
      "https://www.ycombinator.com/companies/haddock"
    ]
  },
  "score": {
    "product_fit": 12.0,
    "team_execution": 7.5,
    "market_timing": 10.0,
    "traction": 3.0,
    "differentiation": 1.0,
    "total": 33.5
  },
  "confidence": "high",
  "flags": []
}