{
  "schema_version": "1",
  "run_id": "20260825-135831-5ded14",
  "candidate_name": "StripeMeter",
  "source_url": "https://news.ycombinator.com/item?id=45261999",
  "team": {
    "summary": "The only available team information is the founder's handle, 'coryli'. There is no detail on background, technical expertise, or prior experience, so team fit cannot be confidently assessed.",
    "citations": [
      "https://github.com/geminimir/stripemeter"
    ]
  },
  "product": {
    "summary": "StripeMeter offers 'pre-invoice parity for Stripe usage billing.' This suggests it addresses a specific workflow related to Stripe billing, potentially helping users reconcile or preview invoices before they are finalized. However, it is unclear if the product automates the workflow end-to-end or acts as an agent making decisions and taking actions, as required by the thesis.",
    "citations": [
      "https://github.com/geminimir/stripemeter"
    ]
  },
  "market": {
    "summary": "The product appears to target users of Stripe usage billing, which may include SMBs, but the data does not specify the primary customer segment or the prevalence of this workflow among SMBs. There is no explicit 'why now' or evidence of a broad market need.",
    "citations": [
      "https://github.com/geminimir/stripemeter"
    ]
  },
  "traction": {
    "summary": "The only traction evidence is a Hacker News post with 2 points. There is no information on users, revenue, or other adoption metrics.",
    "citations": [
      "https://news.ycombinator.com/item?id=45261999"
    ]
  },
  "risks": {
    "summary": "Key risks include unclear product scope (whether it is agentic and end-to-end), lack of team background, and limited evidence of market demand or traction. The available data is too thin to assess defensibility or execution.",
    "citations": [
      "https://github.com/geminimir/stripemeter",
      "https://news.ycombinator.com/item?id=45261999"
    ]
  },
  "differentiation": {
    "summary": "There is no information on proprietary technology, data, or defensible workflow depth. Differentiation cannot be assessed from the available data.",
    "citations": [
      "https://github.com/geminimir/stripemeter"
    ]
  },
  "score": {
    "product_fit": 9.0,
    "team_execution": 2.5,
    "market_timing": 4.0,
    "traction": 1.5,
    "differentiation": 1.0,
    "total": 18.0
  },
  "confidence": "high",
  "flags": []
}