{
  "schema_version": "1",
  "run_id": "20260825-142916-0d7264",
  "candidate_name": "HTML, CSS and JavaScript in the Terminal",
  "source_url": "https://news.ycombinator.com/item?id=48894572",
  "team": {
    "summary": "The project appears to be led by a single founder, 'keepamovin,' who describes themselves as a software designer and 'AI nudger.' They have spent eight years on the browser rendering engine component, with most of the code for the terminal renderer written by AI under their guidance. There is no evidence of a broader team, prior startup experience, or relevant domain expertise beyond this technical work.",
    "citations": [
      "https://news.ycombinator.com/item?id=48894572"
    ]
  },
  "product": {
    "summary": "The product is a browser rendering engine and terminal renderer that allows HTML, CSS, and JavaScript applications to be rendered in the terminal and accessed over SSH. It is positioned as a creative tool for building terminal applications and BBS-style boards using web technologies. There is no evidence that it automates a specific, repeatable SMB workflow end-to-end or acts as an agent within such a workflow.",
    "citations": [
      "https://news.ycombinator.com/item?id=48894572"
    ]
  },
  "market": {
    "summary": "There is no evidence that the product targets SMBs or addresses a workflow common across many SMBs. The described use cases focus on creativity, self-hosting, and nostalgia for early internet experiences, rather than business operations or back-office tasks.",
    "citations": [
      "https://news.ycombinator.com/item?id=48894572"
    ]
  },
  "traction": {
    "summary": "The only traction evidence is a Show HN post with 9 points on Hacker News. There is no mention of users, customers, revenue, or other adoption metrics.",
    "citations": [
      "https://news.ycombinator.com/item?id=48894572"
    ]
  },
  "risks": {
    "summary": "The main risks are lack of product-market fit for SMBs, unclear workflow automation, and absence of evidence for business adoption. The project appears to be an individual technical exploration rather than a focused SMB solution.",
    "citations": [
      "https://news.ycombinator.com/item?id=48894572"
    ]
  },
  "differentiation": {
    "summary": "The product is differentiated by its technical approach\u2014rendering web technologies in the terminal and enabling SSH access\u2014but there is no evidence of defensible workflow depth, proprietary data, or distribution advantages relevant to SMB workflow automation.",
    "citations": [
      "https://news.ycombinator.com/item?id=48894572"
    ]
  },
  "score": {
    "product_fit": 3.0,
    "team_execution": 7.5,
    "market_timing": 0.0,
    "traction": 1.5,
    "differentiation": 3.0,
    "total": 15.0
  },
  "confidence": "high",
  "flags": []
}