{
  "schema_version": "1",
  "run_id": "20260825-135831-5ded14",
  "candidate_name": "VisiGrid CLI",
  "source_url": "https://news.ycombinator.com/item?id=46873757",
  "team": {
    "summary": "The only available team information is the founder's handle ('rdoneill'); there is no detail on background, technical expertise, or relevant domain experience.",
    "citations": [
      "https://visigrid.app",
      "https://news.ycombinator.com/item?id=46873757"
    ]
  },
  "product": {
    "summary": "VisiGrid CLI is described as 'Git-diff for financial reconciliation.' This suggests a tool for comparing financial records, but it is unclear if it automates an end-to-end workflow or acts as an agent making decisions and taking actions, as required by the thesis.",
    "citations": [
      "https://visigrid.app"
    ]
  },
  "market": {
    "summary": "The product addresses financial reconciliation, a workflow relevant to many businesses, including SMBs. However, there is no explicit evidence that SMBs are the primary target or that the workflow is tailored specifically for them.",
    "citations": [
      "https://visigrid.app"
    ]
  },
  "traction": {
    "summary": "The only traction evidence is a single Hacker News point, with no additional usage, funding, or engagement data available.",
    "citations": [
      "https://news.ycombinator.com/item?id=46873757"
    ]
  },
  "risks": {
    "summary": "Key risks include lack of clarity on whether the product is agentic or automates the workflow end-to-end, limited team information, and minimal traction signal. The target customer segment (SMBs) is not explicitly confirmed.",
    "citations": [
      "https://visigrid.app",
      "https://news.ycombinator.com/item?id=46873757"
    ]
  },
  "differentiation": {
    "summary": "Differentiation is unclear from the available data. The 'Git-diff' analogy may imply a novel approach to reconciliation, but there is no evidence of proprietary technology, workflow depth, or defensible edge.",
    "citations": [
      "https://visigrid.app"
    ]
  },
  "score": {
    "product_fit": 9.0,
    "team_execution": 5.0,
    "market_timing": 8.0,
    "traction": 1.5,
    "differentiation": 2.0,
    "total": 25.5
  },
  "confidence": "high",
  "flags": []
}