{
  "schema_version": "1",
  "run_id": "20260825-135831-5ded14",
  "candidate_name": "Nomod payment integrated into usage-based billing stack",
  "source_url": "https://news.ycombinator.com/item?id=46812105",
  "team": {
    "summary": "The only available team information is the founder's name: ShreyaChaurasia. There is no data on relevant domain expertise, technical background, or prior startup experience.",
    "citations": [
      "https://news.ycombinator.com/item?id=46812105"
    ]
  },
  "product": {
    "summary": "Flexprice is an open-source billing system that now integrates with Nomod to handle invoices, usage, and credit wallets. The integration syncs finalized invoices to Nomod, generates hosted payment links, updates payment status back into Flexprice, and ensures credits are applied only after payment succeeds. This automates the payment collection and reconciliation process within the billing workflow, but it is not explicitly described as an agent that takes actions or makes decisions autonomously.",
    "citations": [
      "https://news.ycombinator.com/item?id=46812105"
    ]
  },
  "market": {
    "summary": "The product addresses billing and payment reconciliation, which are common workflows for SMBs. However, there is no explicit evidence in the data about the breadth of SMB adoption or a specific 'why now' justification.",
    "citations": [
      "https://news.ycombinator.com/item?id=46812105"
    ]
  },
  "traction": {
    "summary": "The only traction evidence is a Show HN post with 9 points on Hacker News. There is no mention of users, customers, funding, or other adoption metrics.",
    "citations": [
      "https://news.ycombinator.com/item?id=46812105"
    ]
  },
  "risks": {
    "summary": "Key risks include limited evidence of agentic automation (vs. workflow integration), unclear SMB adoption, and lack of team background or execution track record. The open-source nature may also impact defensibility and monetization.",
    "citations": [
      "https://news.ycombinator.com/item?id=46812105"
    ]
  },
  "differentiation": {
    "summary": "Differentiation appears to be the open-source approach and the ability to integrate region-specific payment providers without breaking billing state. There is no evidence of proprietary data, deep workflow ownership, or unique distribution.",
    "citations": [
      "https://news.ycombinator.com/item?id=46812105"
    ]
  },
  "score": {
    "product_fit": 12.0,
    "team_execution": 5.0,
    "market_timing": 10.0,
    "traction": 4.5,
    "differentiation": 3.0,
    "total": 34.5
  },
  "confidence": "high",
  "flags": []
}