{
  "schema_version": "1",
  "run_id": "20260825-135831-5ded14",
  "candidate_name": "Zolvo",
  "source_url": "https://www.ycombinator.com/companies/zolvo",
  "team": {
    "summary": "The founding team consists of Isabela Rodriguez and Tony Montes. No further information about their backgrounds, technical expertise, or prior experience is provided in the available data.",
    "citations": [
      "https://www.ycombinator.com/companies/zolvo"
    ]
  },
  "product": {
    "summary": "Zolvo offers 'AI Back-Office Automation for Commercial Lenders.' While this suggests automation of back-office workflows in the commercial lending sector, the data does not specify which workflow(s) are automated, nor does it clarify if the product acts as an agent that takes actions and makes decisions end-to-end.",
    "citations": [
      "https://www.ycombinator.com/companies/zolvo"
    ]
  },
  "market": {
    "summary": "The product targets commercial lenders, which may include SMBs, but the data does not explicitly state that SMBs are the primary buyer. The workflow relevance and prevalence across SMBs cannot be fully determined from the available information.",
    "citations": [
      "https://www.ycombinator.com/companies/zolvo"
    ]
  },
  "traction": {
    "summary": "The only traction evidence available is that Zolvo is part of the YC Spring 2026 batch. No additional traction, usage, or community engagement data is provided.",
    "citations": [
      "https://www.ycombinator.com/companies/zolvo"
    ]
  },
  "risks": {
    "summary": "Key risks include lack of clarity on the specific workflow automated, whether the solution is agentic, and whether SMBs are the primary customer. There is also no information on team experience or market traction beyond YC participation.",
    "citations": [
      "https://www.ycombinator.com/companies/zolvo"
    ]
  },
  "differentiation": {
    "summary": "There is no information provided about proprietary technology, workflow depth, integrations, or other defensible differentiation.",
    "citations": [
      "https://www.ycombinator.com/companies/zolvo"
    ]
  },
  "score": {
    "product_fit": 9.0,
    "team_execution": 5.0,
    "market_timing": 6.0,
    "traction": 4.5,
    "differentiation": 1.0,
    "total": 25.5
  },
  "confidence": "high",
  "flags": []
}