{
  "schema_version": "1",
  "run_id": "20260825-142916-0d7264",
  "candidate_name": "Autonomous Bookkeeping and CFO Agent",
  "source_url": "https://news.ycombinator.com/item?id=45840860",
  "team": {
    "summary": "The only available team information is the founder's handle ('bmadduma'); there is no detail on domain expertise, technical background, or prior experience. Insufficient data to assess team strength or execution capability.",
    "citations": [
      "https://news.ycombinator.com/item?id=45840860"
    ]
  },
  "product": {
    "summary": "The product claims to be an 'AI CFO that closes your books automatically,' suggesting it automates the bookkeeping and financial closing workflow. The language implies agentic behavior (closing books), and the workflow is named and specific (bookkeeping/financial close).",
    "citations": [
      "https://news.ycombinator.com/item?id=45840860"
    ]
  },
  "market": {
    "summary": "Bookkeeping and financial close are common workflows across SMBs. However, there is no explicit statement that SMBs are the primary buyer, though the workflow is highly relevant to this segment.",
    "citations": [
      "https://news.ycombinator.com/item?id=45840860"
    ]
  },
  "traction": {
    "summary": "The only traction evidence is the Hacker News post, which has 2 points. There is no information on user numbers, revenue, or other traction metrics.",
    "citations": [
      "https://news.ycombinator.com/item?id=45840860"
    ]
  },
  "risks": {
    "summary": "Key risks include lack of information about the team's ability to execute, unclear differentiation, and minimal traction signal. There is also no detail on integrations, proprietary data, or defensibility.",
    "citations": [
      "https://news.ycombinator.com/item?id=45840860"
    ]
  },
  "differentiation": {
    "summary": "There is no evidence of defensible technology, proprietary data, or unique integrations. The product description does not clarify how it is differentiated from other AI bookkeeping solutions.",
    "citations": [
      "https://news.ycombinator.com/item?id=45840860"
    ]
  },
  "score": {
    "product_fit": 27.0,
    "team_execution": 5.0,
    "market_timing": 14.0,
    "traction": 1.5,
    "differentiation": 2.0,
    "total": 49.5
  },
  "confidence": "high",
  "flags": []
}