{
  "schema_version": "1",
  "run_id": "20260825-135831-5ded14",
  "candidate_name": "AI code generator with 93% validation success (Python)",
  "source_url": "https://news.ycombinator.com/item?id=45623993",
  "team": {
    "summary": "The only founder listed is 'tekodu'. There is no information provided about the founder's background, technical expertise, or prior startup experience, so it is not possible to assess the team's domain or execution strength from the available data.",
    "citations": [
      "https://news.ycombinator.com/item?id=45623993"
    ]
  },
  "product": {
    "summary": "The product is an AI engine that generates production-ready Python code from plain English descriptions. It has demonstrated the ability to generate tools such as invoice matching systems, authentication APIs, and web scrapers. However, it is a general-purpose code generator rather than an agent that automates a single, named SMB workflow end-to-end. While it can generate code for specific workflows (e.g., invoice matching), it does not itself act as an agent or own the execution of a workflow.",
    "citations": [
      "https://news.ycombinator.com/item?id=45623993"
    ]
  },
  "market": {
    "summary": "The product targets developers seeking to generate Python tools, but there is no evidence that SMBs are the primary buyer or that the product is focused on a workflow common across many SMBs. The product is positioned as a code generation tool rather than a workflow automation solution for SMBs.",
    "citations": [
      "https://news.ycombinator.com/item?id=45623993"
    ]
  },
  "traction": {
    "summary": "The only traction evidence is a Hacker News post with 2 points. There is no information on user growth, revenue, or other adoption metrics.",
    "citations": [
      "https://news.ycombinator.com/item?id=45623993"
    ]
  },
  "risks": {
    "summary": "Key risks include unclear fit with the thesis (not a workflow-specific agent for SMBs), lack of evidence for SMB adoption, and limited information about the founder's background or ability to execute. The product is still in beta and currently limited to Python.",
    "citations": [
      "https://news.ycombinator.com/item?id=45623993"
    ]
  },
  "differentiation": {
    "summary": "The product claims high validation success (93%) and the ability to generate production-grade code with security and error handling. However, there is no evidence of proprietary data, unique integrations, or defensible workflow depth. Differentiation appears limited to technical validation results.",
    "citations": [
      "https://news.ycombinator.com/item?id=45623993"
    ]
  },
  "score": {
    "product_fit": 6.0,
    "team_execution": 2.5,
    "market_timing": 4.0,
    "traction": 1.5,
    "differentiation": 2.0,
    "total": 16.0
  },
  "confidence": "high",
  "flags": []
}