{
  "schema_version": "1",
  "run_id": "20260825-135831-5ded14",
  "candidate_name": "Chipax",
  "source_url": "https://www.ycombinator.com/companies/chipax",
  "team": {
    "summary": "The founding team consists of Antonio Correa, Fran\u00e7ois Gueneau de Mussy, and Felipe Urz\u00faa. No additional information about their backgrounds, technical expertise, or prior startup experience is provided in the available data.",
    "citations": [
      "https://www.ycombinator.com/companies/chipax"
    ]
  },
  "product": {
    "summary": "Chipax is described as 'Quickbooks for SMBs in Latam.' This suggests it is a financial management tool for small and medium businesses in Latin America. However, there is no explicit evidence that it automates a specific, named workflow end-to-end or acts as an agent rather than a software platform.",
    "citations": [
      "https://www.ycombinator.com/companies/chipax"
    ]
  },
  "market": {
    "summary": "The product targets SMBs in Latin America, a large and underserved market segment for financial software. The workflow of financial management is common across many SMBs, but there is no explicit 'why now' or market timing rationale provided.",
    "citations": [
      "https://www.ycombinator.com/companies/chipax"
    ]
  },
  "traction": {
    "summary": "The only traction evidence available is Chipax's participation in YC's Summer 2021 batch. No additional data on usage, funding, or community engagement is provided.",
    "citations": [
      "https://www.ycombinator.com/companies/chipax"
    ]
  },
  "risks": {
    "summary": "Key risks include lack of evidence that Chipax automates a specific workflow end-to-end or acts as an agent, as well as limited information on team execution capability and current traction.",
    "citations": [
      "https://www.ycombinator.com/companies/chipax"
    ]
  },
  "differentiation": {
    "summary": "There is no information provided on proprietary technology, workflow depth, integrations, or defensible edge beyond being a regional Quickbooks analogue.",
    "citations": [
      "https://www.ycombinator.com/companies/chipax"
    ]
  },
  "score": {
    "product_fit": 6.0,
    "team_execution": 7.5,
    "market_timing": 10.0,
    "traction": 3.0,
    "differentiation": 2.0,
    "total": 28.5
  },
  "confidence": "high",
  "flags": []
}